{
  "schema": "fenix.recipe.v1",
  "name": "optee_userspace_deb_aml",
  "version": "0+e05c34b81f65fa10f534984a370001807fbd5c48",
  "summary": "Amlogic OP-TEE userspace prebuilt deb wrapper",
  "license": "GPL-2.0-or-later; license audit required for binary payload",
  "source": {
    "type": "vendor-blob",
    "uri": "https://github.com/numbqq/optee_userspace_deb_aml/archive/e05c34b81f65fa10f534984a370001807fbd5c48.tar.gz",
    "sha256": "06011c34c8ab5a55f69d9bbc2c4cbf6a3059f77f6f7d577112d5d77279c7f0c0"
  },
  "build": {
    "class": "vendor-blob"
  },
  "dependencies": {
    "recipes": [],
    "distro_dev": [],
    "native_tools": []
  },
  "outputs": [
    {
      "package": "optee-userspace-deb-aml",
      "architecture": "arm64",
      "section": "utils",
      "priority": "optional",
      "description": "Tracked exception for legacy Amlogic OP-TEE userspace prebuilt deb payloads.",
      "runtime_depends": [],
      "files": []
    }
  ],
  "vendor_blob": {
    "origin": "https://github.com/numbqq/optee_userspace_deb_aml",
    "version": "e05c34b81f65fa10f534984a370001807fbd5c48",
    "sha256": "06011c34c8ab5a55f69d9bbc2c4cbf6a3059f77f6f7d577112d5d77279c7f0c0",
    "license_category": "prebuilt Amlogic OP-TEE userspace deb; license audit required",
    "reason_source_unavailable": "Repository contains distro/architecture deb payloads rather than a source tree for this userspace package.",
    "replacement": {
      "owner": "fenix-migration",
      "status": "Keep as temporary exception until an OP-TEE source build path is wired into Fenix recipes."
    }
  }
}
