{
  "schema": "fenix.recipe.v1",
  "name": "gst-aml-dma-allocator",
  "version": "0.1+streambox1",
  "summary": "GStreamer wrapper for the Amlogic DMA allocator",
  "license": "Amlogic; license audit required",
  "source": {
    "type": "local",
    "path": "../../../reference/aml-comp/multimedia/gst-aml-utils/gst-aml-dma-allocator"
  },
  "build": {
    "class": "make",
    "targets": ["clean", "all"]
  },
  "dependencies": {
    "recipes": ["dma-allocator"],
    "distro_dev": ["libgstreamer1.0-dev", "libgstreamer-plugins-base1.0-dev"],
    "native_tools": ["make", "pkg-config"]
  },
  "outputs": [
    {
      "package": "gst-aml-dma-allocator",
      "architecture": "arm64",
      "section": "libs",
      "priority": "optional",
      "description": "Amlogic GStreamer DMA allocator support library and header.",
      "runtime_depends": ["aml-dma-allocator", "libgstreamer1.0-0", "libgstreamer-plugins-base1.0-0"],
      "files": [
        {
          "from": "usr/lib/libgst-aml-dma-allocator.so",
          "to": "/usr/lib/libgst-aml-dma-allocator.so"
        },
        {
          "from": ".fenix-staging/usr/include/gstamldmaallocator.h",
          "to": "/usr/include/gstamldmaallocator.h"
        }
      ],
      "sysroot_exports": [
        {
          "from": "usr/lib/libgst-aml-dma-allocator.so",
          "to": "/usr/lib/libgst-aml-dma-allocator.so"
        },
        {
          "from": ".fenix-staging/usr/include/gstamldmaallocator.h",
          "to": "/usr/include/gstamldmaallocator.h"
        }
      ]
    }
  ],
  "metadata": {
    "streambox_scope": "direct dependency for scoped GE2D/GStreamer port",
    "source_status": "workspace-local Yocto-origin source; gitlink pin recorded from multimedia affb028; source branch setup pending before edits",
    "source_repo": "git@github.com:aml-streambox/gst-aml-utils.git",
    "source_revision": "5e7295a4a259e28f515efa5bcd0ce730cbc0958c"
  }
}
