{
  "schema": "fenix.recipe.v1",
  "name": "vfm-cap",
  "version": "0.1.0+local1",
  "summary": "VFM capture out-of-tree kernel module",
  "license": "GPL-2.0-or-later",
  "source": {
    "type": "local",
    "path": "../reference/streambox/common_drivers_streambox/drivers/media/vfm_cap"
  },
  "patches": ["patches/add-video-cap-udev-rule.patch"],
  "build": {
    "class": "kernel-module",
    "build_args": []
  },
  "dependencies": {
    "recipes": [],
    "distro_dev": [],
    "native_tools": ["make"]
  },
  "outputs": [
    {
      "package": "vfm-cap-modules",
      "architecture": "arm64",
      "section": "kernel",
      "priority": "optional",
      "description": "VFM capture kernel module",
      "runtime_depends": ["kmod"],
      "files": [],
      "kernel_modules": [
        {
          "path": "/lib/modules/${kernel_version}/extra/vfm-cap/vfm_cap.ko",
          "autoload": "vfm_cap",
          "udev_rules": ["udev/99-vfm-cap.rules"]
        }
      ]
    }
  ]
}
